{
  "schemaVersion": 1,
  "screen": "S17-multi-agent-panel",
  "purpose": "Compare blind specialized AI analyses and disagreements.",
  "primaryQuestion": "Where do specialized agents agree, disagree, and identify different work?",
  "regions": [
    {
      "id": "source-version",
      "purpose": "Expose source version needed to answer the screen's primary question.",
      "hierarchy": "primary",
      "visibility": {
        "kind": "always"
      }
    },
    {
      "id": "roles",
      "purpose": "Expose roles needed to answer the screen's primary question.",
      "hierarchy": "primary",
      "visibility": {
        "kind": "always"
      }
    },
    {
      "id": "proposals",
      "purpose": "Expose proposals needed to answer the screen's primary question.",
      "hierarchy": "secondary",
      "visibility": {
        "kind": "always"
      }
    },
    {
      "id": "disagreements",
      "purpose": "Expose disagreements needed to answer the screen's primary question.",
      "hierarchy": "secondary",
      "visibility": {
        "kind": "always"
      }
    },
    {
      "id": "provenance",
      "purpose": "Expose provenance needed to answer the screen's primary question.",
      "hierarchy": "tertiary",
      "visibility": {
        "kind": "always"
      }
    }
  ],
  "capabilities": [],
  "stateProjections": [
    {
      "when": "material-blocker-exists",
      "observations": [
        {
          "id": "blocker-visible",
          "description": "Any material blocker relevant to this screen remains perceivable and inspectable."
        },
        {
          "id": "no-false-authority",
          "description": "The UI does not imply an unavailable or unverified state is authoritative."
        }
      ]
    }
  ],
  "forbiddenPatterns": [
    "named:majority-vote-equals-truth"
  ],
  "breakpoints": [
    {
      "name": "ipad-portrait",
      "width": 820,
      "height": 1180,
      "requiredRegionsVisible": [
        "source-version",
        "roles"
      ],
      "observations": [
        {
          "id": "ipad-portrait-semantic-priority",
          "description": "Primary semantic meaning remains directly reachable without hover."
        },
        {
          "id": "ipad-portrait-blocked-state",
          "description": "Material blockers remain discoverable in the primary task flow."
        }
      ]
    },
    {
      "name": "ipad-landscape",
      "width": 1180,
      "height": 820,
      "requiredRegionsVisible": [
        "source-version",
        "roles"
      ],
      "observations": [
        {
          "id": "ipad-landscape-semantic-priority",
          "description": "Primary semantic meaning remains directly reachable without hover."
        },
        {
          "id": "ipad-landscape-blocked-state",
          "description": "Material blockers remain discoverable in the primary task flow."
        }
      ]
    },
    {
      "name": "narrow-phone",
      "width": 390,
      "height": 844,
      "requiredRegionsVisible": [
        "source-version",
        "roles"
      ],
      "observations": [
        {
          "id": "narrow-phone-semantic-priority",
          "description": "Primary semantic meaning remains directly reachable without hover."
        },
        {
          "id": "narrow-phone-blocked-state",
          "description": "Material blockers remain discoverable in the primary task flow."
        }
      ]
    },
    {
      "name": "desktop-reference",
      "width": 1440,
      "height": 900,
      "requiredRegionsVisible": [
        "source-version",
        "roles"
      ],
      "observations": [
        {
          "id": "desktop-reference-semantic-priority",
          "description": "Primary semantic meaning remains directly reachable without hover."
        },
        {
          "id": "desktop-reference-blocked-state",
          "description": "Material blockers remain discoverable in the primary task flow."
        }
      ]
    }
  ],
  "evidenceRequirements": [
    {
      "id": "contract",
      "kind": "contract-validation",
      "description": "Contract validates against Percepta schema.",
      "required": true
    },
    {
      "id": "structural",
      "kind": "structural",
      "description": "Required semantic regions are present.",
      "required": true
    },
    {
      "id": "state",
      "kind": "state-projection",
      "description": "Material state projects to the required UI meaning.",
      "required": true
    },
    {
      "id": "interaction",
      "kind": "interaction",
      "description": "Required actions and blocked-action explanations behave correctly.",
      "required": true
    },
    {
      "id": "accessibility",
      "kind": "accessibility",
      "description": "Keyboard, focus, labels, and semantic state are accessible.",
      "required": true
    },
    {
      "id": "responsive",
      "kind": "responsive",
      "description": "Critical meaning survives iPad, phone, desktop, and high-density layouts.",
      "required": true
    }
  ]
}
