{
  "schemaVersion": 1,
  "screen": "S07-evidence-dependency",
  "purpose": "Reveal common-source and derived evidence relationships.",
  "primaryQuestion": "Are these records actually independent?",
  "regions": [
    {
      "id": "dependency-graph",
      "purpose": "Expose dependency graph needed to answer the screen's primary question.",
      "hierarchy": "primary",
      "visibility": {
        "kind": "always"
      }
    },
    {
      "id": "lineage-table",
      "purpose": "Expose lineage table needed to answer the screen's primary question.",
      "hierarchy": "primary",
      "visibility": {
        "kind": "always"
      }
    }
  ],
  "capabilities": [],
  "stateProjections": [
    {
      "when": "material-blocker-exists",
      "observations": [
        {
          "id": "blocker-visible",
          "description": "Any material blocker relevant to this screen remains perceivable and inspectable."
        },
        {
          "id": "no-false-authority",
          "description": "The UI does not imply an unavailable or unverified state is authoritative."
        }
      ]
    }
  ],
  "forbiddenPatterns": [
    "imply-dependent-records-are-independent"
  ],
  "breakpoints": [
    {
      "name": "ipad-portrait",
      "width": 820,
      "height": 1180,
      "requiredRegionsVisible": [
        "dependency-graph",
        "lineage-table"
      ],
      "observations": [
        {
          "id": "semantic-priority",
          "description": "Primary semantic meaning remains directly reachable without hover."
        },
        {
          "id": "blocked-state",
          "description": "Material blockers remain discoverable in the primary task flow."
        }
      ]
    },
    {
      "name": "ipad-landscape",
      "width": 1180,
      "height": 820,
      "requiredRegionsVisible": [
        "dependency-graph",
        "lineage-table"
      ],
      "observations": [
        {
          "id": "semantic-priority",
          "description": "Primary semantic meaning remains directly reachable without hover."
        },
        {
          "id": "blocked-state",
          "description": "Material blockers remain discoverable in the primary task flow."
        }
      ]
    },
    {
      "name": "narrow-phone",
      "width": 390,
      "height": 844,
      "requiredRegionsVisible": [
        "dependency-graph",
        "lineage-table"
      ],
      "observations": [
        {
          "id": "semantic-priority",
          "description": "Primary semantic meaning remains directly reachable without hover."
        },
        {
          "id": "blocked-state",
          "description": "Material blockers remain discoverable in the primary task flow."
        }
      ]
    },
    {
      "name": "desktop-reference",
      "width": 1440,
      "height": 900,
      "requiredRegionsVisible": [
        "dependency-graph",
        "lineage-table"
      ],
      "observations": [
        {
          "id": "semantic-priority",
          "description": "Primary semantic meaning remains directly reachable without hover."
        },
        {
          "id": "blocked-state",
          "description": "Material blockers remain discoverable in the primary task flow."
        }
      ]
    }
  ],
  "evidenceRequirements": [
    {
      "id": "contract",
      "kind": "contract-validation",
      "description": "Contract validates against Percepta schema.",
      "required": true
    },
    {
      "id": "structural",
      "kind": "structural",
      "description": "Required semantic regions are present.",
      "required": true
    },
    {
      "id": "state",
      "kind": "state-projection",
      "description": "Material state projects to the required UI meaning.",
      "required": true
    },
    {
      "id": "interaction",
      "kind": "interaction",
      "description": "Required actions and blocked-action explanations behave correctly.",
      "required": true
    },
    {
      "id": "accessibility",
      "kind": "accessibility",
      "description": "Keyboard, focus, labels, and semantic state are accessible.",
      "required": true
    },
    {
      "id": "responsive",
      "kind": "responsive",
      "description": "Critical meaning survives iPad, phone, desktop, and high-density layouts.",
      "required": true
    }
  ]
}
