{
  "schemaVersion": 1,
  "screen": "S21-requirements-proof",
  "purpose": "Trace a requirement to implementation and runtime evidence.",
  "primaryQuestion": "What proves this requirement is actually satisfied?",
  "regions": [
    {
      "id": "requirement",
      "purpose": "Expose requirement needed to answer the screen's primary question.",
      "hierarchy": "primary",
      "visibility": {
        "kind": "always"
      }
    },
    {
      "id": "scenario",
      "purpose": "Expose scenario needed to answer the screen's primary question.",
      "hierarchy": "primary",
      "visibility": {
        "kind": "always"
      }
    },
    {
      "id": "work-item",
      "purpose": "Expose work item needed to answer the screen's primary question.",
      "hierarchy": "secondary",
      "visibility": {
        "kind": "always"
      }
    },
    {
      "id": "source",
      "purpose": "Expose source needed to answer the screen's primary question.",
      "hierarchy": "secondary",
      "visibility": {
        "kind": "always"
      }
    },
    {
      "id": "test",
      "purpose": "Expose test needed to answer the screen's primary question.",
      "hierarchy": "tertiary",
      "visibility": {
        "kind": "always"
      }
    },
    {
      "id": "commit",
      "purpose": "Expose commit needed to answer the screen's primary question.",
      "hierarchy": "tertiary",
      "visibility": {
        "kind": "always"
      }
    },
    {
      "id": "runtime-evidence",
      "purpose": "Expose runtime evidence needed to answer the screen's primary question.",
      "hierarchy": "tertiary",
      "visibility": {
        "kind": "always"
      }
    }
  ],
  "capabilities": [],
  "stateProjections": [
    {
      "when": "material-blocker-exists",
      "observations": [
        {
          "id": "blocker-visible",
          "description": "Any material blocker relevant to this screen remains perceivable and inspectable."
        },
        {
          "id": "no-false-authority",
          "description": "The UI does not imply an unavailable or unverified state is authoritative."
        }
      ]
    }
  ],
  "forbiddenPatterns": [
    "named:fabricate-missing-trace"
  ],
  "breakpoints": [
    {
      "name": "ipad-portrait",
      "width": 820,
      "height": 1180,
      "requiredRegionsVisible": [
        "requirement",
        "scenario"
      ],
      "observations": [
        {
          "id": "ipad-portrait-semantic-priority",
          "description": "Primary semantic meaning remains directly reachable without hover."
        },
        {
          "id": "ipad-portrait-blocked-state",
          "description": "Material blockers remain discoverable in the primary task flow."
        }
      ]
    },
    {
      "name": "ipad-landscape",
      "width": 1180,
      "height": 820,
      "requiredRegionsVisible": [
        "requirement",
        "scenario"
      ],
      "observations": [
        {
          "id": "ipad-landscape-semantic-priority",
          "description": "Primary semantic meaning remains directly reachable without hover."
        },
        {
          "id": "ipad-landscape-blocked-state",
          "description": "Material blockers remain discoverable in the primary task flow."
        }
      ]
    },
    {
      "name": "narrow-phone",
      "width": 390,
      "height": 844,
      "requiredRegionsVisible": [
        "requirement",
        "scenario"
      ],
      "observations": [
        {
          "id": "narrow-phone-semantic-priority",
          "description": "Primary semantic meaning remains directly reachable without hover."
        },
        {
          "id": "narrow-phone-blocked-state",
          "description": "Material blockers remain discoverable in the primary task flow."
        }
      ]
    },
    {
      "name": "desktop-reference",
      "width": 1440,
      "height": 900,
      "requiredRegionsVisible": [
        "requirement",
        "scenario"
      ],
      "observations": [
        {
          "id": "desktop-reference-semantic-priority",
          "description": "Primary semantic meaning remains directly reachable without hover."
        },
        {
          "id": "desktop-reference-blocked-state",
          "description": "Material blockers remain discoverable in the primary task flow."
        }
      ]
    }
  ],
  "evidenceRequirements": [
    {
      "id": "contract",
      "kind": "contract-validation",
      "description": "Contract validates against Percepta schema.",
      "required": true
    },
    {
      "id": "structural",
      "kind": "structural",
      "description": "Required semantic regions are present.",
      "required": true
    },
    {
      "id": "state",
      "kind": "state-projection",
      "description": "Material state projects to the required UI meaning.",
      "required": true
    },
    {
      "id": "interaction",
      "kind": "interaction",
      "description": "Required actions and blocked-action explanations behave correctly.",
      "required": true
    },
    {
      "id": "accessibility",
      "kind": "accessibility",
      "description": "Keyboard, focus, labels, and semantic state are accessible.",
      "required": true
    },
    {
      "id": "responsive",
      "kind": "responsive",
      "description": "Critical meaning survives iPad, phone, desktop, and high-density layouts.",
      "required": true
    }
  ]
}
